{"$schema":"https://json-schema.org/draft/2020-12/schema","$id":"fss.clock_alignment_query.v1","title":"Finite moving-feature clock-offset query","description":"Shape contract. Native admission additionally checks exact integer ranges (including strings), proper camera geometry, temporal/source membership, distinct cameras/clocks, finite numeric bounds and complete unique offsets within +/-60 seconds.","type":"object","additionalProperties":false,"required":["schema","world_basis","association_evidence","reference_camera","target_camera","offsets_ns","fit_options","training","validation"],"properties":{"schema":{"const":"fss.clock_alignment_query.v1"},"world_basis":{"$ref":"#/$defs/digest"},"association_evidence":{"$ref":"#/$defs/digest"},"reference_camera":{"$ref":"#/$defs/camera"},"target_camera":{"$ref":"#/$defs/camera"},"offsets_ns":{"type":"array","items":{"$ref":"#/$defs/time"},"minItems":1,"maxItems":64,"uniqueItems":true},"fit_options":{"type":"object","additionalProperties":false,"required":["max_reprojection_pixels","max_distance","max_speed","max_condition_number","max_iterations"],"properties":{"max_reprojection_pixels":{"type":"number"},"max_distance":{"type":"number"},"max_speed":{"type":"number"},"max_condition_number":{"type":"number"},"max_iterations":{"oneOf":[{"type":"integer","minimum":1,"maximum":32},{"type":"string","maxLength":2,"pattern":"^[1-9][0-9]*$"}]}}},"training":{"type":"array","items":{"$ref":"#/$defs/training"},"minItems":1,"maxItems":128},"validation":{"type":"array","items":{"$ref":"#/$defs/validation"},"minItems":1,"maxItems":128}},"$defs":{"positiveInteger":{"oneOf":[{"type":"integer","minimum":1,"maximum":18446744073709551615},{"type":"string","maxLength":20,"pattern":"^[1-9][0-9]*$"}]},"time":{"oneOf":[{"type":"integer","minimum":-170141183460469231731687303715884105728,"maximum":170141183460469231731687303715884105727},{"type":"string","maxLength":40,"pattern":"^-?(0|[1-9][0-9]*)$"}]},"digest":{"type":"string","pattern":"^sha256:[0-9a-fA-F]{64}$"},"camera":{"type":"object","additionalProperties":false,"required":["id","clock","calibration_digest","image_domain","intrinsics","rotation","center"],"properties":{"id":{"$ref":"#/$defs/positiveInteger"},"clock":{"$ref":"#/$defs/positiveInteger"},"calibration_digest":{"$ref":"#/$defs/digest"},"image_domain":{"$ref":"#/$defs/digest"},"intrinsics":{"type":"object","additionalProperties":false,"required":["width","height","fx","fy","cx","cy"],"properties":{"width":{"oneOf":[{"type":"integer","minimum":1,"maximum":65536},{"type":"string","maxLength":5,"pattern":"^[1-9][0-9]*$"}]},"height":{"oneOf":[{"type":"integer","minimum":1,"maximum":65536},{"type":"string","maxLength":5,"pattern":"^[1-9][0-9]*$"}]},"fx":{"type":"number"},"fy":{"type":"number"},"cx":{"type":"number"},"cy":{"type":"number"}}},"rotation":{"type":"array","items":{"type":"array","items":{"type":"number"},"minItems":3,"maxItems":3},"minItems":3,"maxItems":3},"center":{"type":"array","items":{"type":"number"},"minItems":3,"maxItems":3}}},"training":{"type":"object","additionalProperties":false,"required":["camera","clock","pixel","sigma_pixels","exposure","source_digest","evidence_digest","capture_ns"],"properties":{"camera":{"$ref":"#/$defs/positiveInteger"},"clock":{"$ref":"#/$defs/positiveInteger"},"pixel":{"type":"array","items":{"type":"number"},"minItems":2,"maxItems":2},"sigma_pixels":{"type":"number","minimum":0.001,"maximum":1000},"exposure":{"type":"string","minLength":1,"maxLength":256},"source_digest":{"$ref":"#/$defs/digest"},"evidence_digest":{"$ref":"#/$defs/digest"},"capture_ns":{"$ref":"#/$defs/time"}}},"validation":{"type":"object","additionalProperties":false,"required":["camera","clock","pixel","sigma_pixels","exposure","source_digest","evidence_digest","capture_interval_ns"],"properties":{"camera":{"$ref":"#/$defs/positiveInteger"},"clock":{"$ref":"#/$defs/positiveInteger"},"pixel":{"type":"array","items":{"type":"number"},"minItems":2,"maxItems":2},"sigma_pixels":{"type":"number","minimum":0.001,"maximum":1000},"exposure":{"type":"string","minLength":1,"maxLength":256},"source_digest":{"$ref":"#/$defs/digest"},"evidence_digest":{"$ref":"#/$defs/digest"},"capture_interval_ns":{"type":"array","items":{"$ref":"#/$defs/time"},"minItems":2,"maxItems":2}}}}}
