{
  "schema": "fss.clock_alignment_query.v1",
  "world_basis": "sha256:2c1d7b1f1cf3c103eff47b4c1cc34b70e22707748439b5efc205296424d0f3e4",
  "association_evidence": "sha256:c4f0d2c43440daf6cdcaf05113ec711bec42d6199d20851d3ed123adc702d069",
  "reference_camera": {
    "id": 1,
    "clock": 10,
    "calibration_digest": "sha256:aa0cdb8aea2ec7b2e9fc4b9bd5d99b41faecb3368feddfc3d009d840223b93cd",
    "image_domain": "sha256:ee2f479823f5c3d8b173f23b14ac3c19bce7860bd1b0e0d5bf2f84a9c5f4d7f6",
    "intrinsics": {
      "width": 1280,
      "height": 960,
      "fx": 640,
      "fy": 640,
      "cx": 640,
      "cy": 480
    },
    "rotation": [
      [
        1,
        0,
        0
      ],
      [
        0,
        1,
        0
      ],
      [
        0,
        0,
        1
      ]
    ],
    "center": [
      -2,
      0,
      0
    ]
  },
  "target_camera": {
    "id": 2,
    "clock": 20,
    "calibration_digest": "sha256:9f3d441d7e763e050eb0e4b3000c6b3e92b7c7d1f01aa5bb9ed2bd018efc0bfc",
    "image_domain": "sha256:5a2d4bdb78d24f2e5d3354b2bb9070f1763f3dfbfcbd01c934713f9c2254679e",
    "intrinsics": {
      "width": 1280,
      "height": 960,
      "fx": 640,
      "fy": 640,
      "cx": 640,
      "cy": 480
    },
    "rotation": [
      [
        1,
        0,
        0
      ],
      [
        0,
        1,
        0
      ],
      [
        0,
        0,
        1
      ]
    ],
    "center": [
      2,
      1,
      0
    ]
  },
  "offsets_ns": [
    "0",
    "50000000",
    "100000000"
  ],
  "fit_options": {
    "max_reprojection_pixels": 0.05,
    "max_distance": 1000,
    "max_speed": 20,
    "max_condition_number": 10000000000.0,
    "max_iterations": 16
  },
  "training": [
    {
      "camera": 1,
      "clock": 10,
      "pixel": [
        840.7482014388489,
        500.2589928057554
      ],
      "sigma_pixels": 1,
      "exposure": "synthetic:1:-200000000",
      "source_digest": "sha256:5795ecdb3b4a1325525e98fc3acb4c021fba8f50e65918e19967fd0f9e1de2bc",
      "evidence_digest": "sha256:3b4b3fc43719e72b0630313332dfdc4318c7f93d000f1fc0ed81df090c61e4e3",
      "capture_ns": "-200000000"
    },
    {
      "camera": 1,
      "clock": 10,
      "pixel": [
        845.5340501792115,
        499.26881720430106
      ],
      "sigma_pixels": 1,
      "exposure": "synthetic:1:-100000000",
      "source_digest": "sha256:e4928913433db96eba77495813787d8585e1ab9872fd8e4a36e4aaceb565fa29",
      "evidence_digest": "sha256:02e3e31157bb8b93a52c2b9ad8852d4756e25dc0c34eb12c531f0b18bc5368e5",
      "capture_ns": "-100000000"
    },
    {
      "camera": 1,
      "clock": 10,
      "pixel": [
        850.2857142857142,
        498.2857142857143
      ],
      "sigma_pixels": 1,
      "exposure": "synthetic:1:0",
      "source_digest": "sha256:1a378e08fddfd88ac6e591f071f44b18f4aa23c1b4e5375d1e50b1324904fb6a",
      "evidence_digest": "sha256:881bb550ec3aa1de6e3cd15966dcb7b97e88b856bae6d88c40da0fbe407c9fc2",
      "capture_ns": "0"
    },
    {
      "camera": 1,
      "clock": 10,
      "pixel": [
        855.0035587188612,
        497.30960854092524
      ],
      "sigma_pixels": 1,
      "exposure": "synthetic:1:100000000",
      "source_digest": "sha256:6f9b67c0169b3aa2f889e8fad510f8dadbd3c7aed8cc0ad1c7e658847c9b9618",
      "evidence_digest": "sha256:3f4f5d249e2db2014b2f5f0d47b0189c31df026edaf6a25b8df0ab603cd06839",
      "capture_ns": "100000000"
    },
    {
      "camera": 1,
      "clock": 10,
      "pixel": [
        859.6879432624114,
        496.3404255319149
      ],
      "sigma_pixels": 1,
      "exposure": "synthetic:1:200000000",
      "source_digest": "sha256:faa03aac068f231a8256101b7d4f0925bb1af7ca5e2b6f8e92cf60a75a4894d3",
      "evidence_digest": "sha256:dd17c05b890d623219ad6798f25155c876b965d1322a692a82ab4c3d049385e2",
      "capture_ns": "200000000"
    },
    {
      "camera": 2,
      "clock": 20,
      "pixel": [
        472.40287769784175,
        408.1726618705036
      ],
      "sigma_pixels": 1,
      "exposure": "synthetic:2:-200000000",
      "source_digest": "sha256:983be79815d4a9587a9aea7aee90139af0ae0d57c01b4645d89848b6387e2777",
      "evidence_digest": "sha256:f6889a8f47a1bf7663624015484da5cef92ca889eb7e44842a2616b81ac6e7e8",
      "capture_ns": "-150000000"
    },
    {
      "camera": 2,
      "clock": 20,
      "pixel": [
        478.50896057347666,
        407.5125448028674
      ],
      "sigma_pixels": 1,
      "exposure": "synthetic:2:-100000000",
      "source_digest": "sha256:163da6eb576543a65cda3254c9c8e7900793148c2918e0822c3479b816d96749",
      "evidence_digest": "sha256:e40892555b2a68d233a09e459566a7b2179b16b474a98360b0e11a90b04e79ff",
      "capture_ns": "-50000000"
    },
    {
      "camera": 2,
      "clock": 20,
      "pixel": [
        484.57142857142856,
        406.8571428571429
      ],
      "sigma_pixels": 1,
      "exposure": "synthetic:2:0",
      "source_digest": "sha256:5f309577adffd3b3832dca6af40daaad7c63b2eb3734171cbe752738f8b71ee5",
      "evidence_digest": "sha256:db413f0aeb73e463f6ecb3b65df12bbb9fe6c030f06e955950d0ec1208d88b6b",
      "capture_ns": "50000000"
    },
    {
      "camera": 2,
      "clock": 20,
      "pixel": [
        490.5907473309609,
        406.20640569395016
      ],
      "sigma_pixels": 1,
      "exposure": "synthetic:2:100000000",
      "source_digest": "sha256:0673dd4e569c5e5dab2cbfe9a3349f69ad9591959b103014a88585089ebf4f9b",
      "evidence_digest": "sha256:28d023bf5679ac34ce4cae48852744aa3252c533bd965a63a31867162d8ad320",
      "capture_ns": "150000000"
    },
    {
      "camera": 2,
      "clock": 20,
      "pixel": [
        496.5673758865248,
        405.56028368794324
      ],
      "sigma_pixels": 1,
      "exposure": "synthetic:2:200000000",
      "source_digest": "sha256:d28a526f710e6817e641135b5ff1a2dcaee6c2d55dfb2e4255293c7a717b02fc",
      "evidence_digest": "sha256:53ffb754bba55ff8c35ad74213c4a2d4736e821a648e89afe27558d41269946c",
      "capture_ns": "250000000"
    }
  ],
  "validation": [
    {
      "camera": 1,
      "clock": 10,
      "pixel": [
        843.145421903052,
        499.7630161579892
      ],
      "sigma_pixels": 1,
      "exposure": "synthetic:1:-150000000",
      "source_digest": "sha256:f48dd6f836984bcb224fef38673e63fb145d0bc16047e09993fc4ab6eecb87e0",
      "evidence_digest": "sha256:5501769a22d84cbf28f22cde253280a32a3dc60d64fe5c03cd3a9e7d62e35ff8",
      "capture_interval_ns": [
        "-150000000",
        "-150000000"
      ]
    },
    {
      "camera": 1,
      "clock": 10,
      "pixel": [
        857.3499111900533,
        496.8241563055062
      ],
      "sigma_pixels": 1,
      "exposure": "synthetic:1:150000000",
      "source_digest": "sha256:e5b78dd197fe4d43cf762babe0b6a0de1f9b9fed6bea95d0034618088b65286a",
      "evidence_digest": "sha256:b0e25c8829712705c9b859a6679cc7af67ca8f660099cebe9d32f6684ce3a66f",
      "capture_interval_ns": [
        "150000000",
        "150000000"
      ]
    },
    {
      "camera": 2,
      "clock": 20,
      "pixel": [
        475.4614003590665,
        407.8420107719928
      ],
      "sigma_pixels": 1,
      "exposure": "synthetic:2:-150000000",
      "source_digest": "sha256:37d8c6bc768a053678c462efb7d8e25f1cf87757b7fde8f0eb91aaea26058d9f",
      "evidence_digest": "sha256:72ed64a8923476b995cf88de1bf486cc2b56731f3e822b869de4ddf2af48a58e",
      "capture_interval_ns": [
        "-100000000",
        "-100000000"
      ]
    },
    {
      "camera": 2,
      "clock": 20,
      "pixel": [
        493.5843694493783,
        405.8827708703375
      ],
      "sigma_pixels": 1,
      "exposure": "synthetic:2:150000000",
      "source_digest": "sha256:37742ca0f23da3aff7164c181bc2004246b46a9964147318e84831c97a1d51d9",
      "evidence_digest": "sha256:6eb98ac99f3093e31dd89e3e5c56d18c47a3ea9a05d018e9c00d52d8cc4e56be",
      "capture_interval_ns": [
        "200000000",
        "200000000"
      ]
    }
  ]
}
